[{
        "relatedIdentifier":["HI", "HI2"],
        "relatedIdentifierType": ["arXiv"],
        "PMCID": ["id1"],
        "relationType": ["IsCitedBy"],
        "Citation": "citationExample"
    },
		{
        "relatedIdentifier": ["HI3"],
        "relatedIdentifierType": ["DOI", "ISBN"],
        "PMCID": ["id1", "id2"],
        "relationType": ["IsDocumentedBy"],
        "Citation": "citationExample2"
    }
]